{
  "schema_version": "1.0",
  "organization_id": "11111111-1111-4111-8111-111111111111",
  "job_id": "22222222-2222-4222-8222-222222222222",
  "sequence": 1,
  "event_id": "33333333-3333-4333-8333-333333333333",
  "event_type": "job.queued",
  "aggregate_version": 3,
  "item_id": null,
  "batch_id": null,
  "association_id": null,
  "occurred_at": "2026-10-13T00:00:00Z"
}
